Tweet,Text Label
"Hello, how are you today?",Non-Predator
"Good morning everyone.",Non-Predator
"This discussion is very helpful.",Non-Predator
"I enjoy learning new topics online.",Non-Predator
"Please follow the community rules.",Non-Predator
"Let us keep the conversation respectful.",Non-Predator
"That is a good question.",Non-Predator
"Thanks for sharing your thoughts.",Non-Predator
"This forum is useful for students.",Non-Predator
"Always stay safe on the internet.",Non-Predator
"You seem mature for your age, let us chat privately.",Predator
"Let us keep our conversation between us.",Predator
"I understand you better than others here.",Predator
"You can trust me, do not tell anyone.",Predator
"Let us move this chat to a private place.",Predator
"I want to know more personal details about you.",Predator
"It is better if others do not know.",Predator
"We should talk when no one is around.",Predator
"Our chat should stay private.",Predator
"I feel a special connection with you.",Predator
"Group conversations are safer.",Non-Predator
"It is okay to ask questions here.",Non-Predator
"This is an educational space.",Non-Predator
"Please avoid sharing personal information.",Non-Predator
"Everyone should feel safe here.",Non-Predator
"Thank you for your cooperation.",Non-Predator
"Public chats help keep people safe.",Non-Predator
"This topic is interesting.",Non-Predator
"Let us stay on topic.",Non-Predator
"I appreciate your opinion.",Non-Predator
"You do not need to involve anyone else.",Predator
"I am the only one who understands you.",Predator
"Others might not approve of our talks.",Predator
"It is better to keep this secret.",Predator
"Trust me, nothing bad will happen.",Predator
"Let us chat late at night.",Predator
"I feel closer to you than others.",Predator
"We should not include others.",Predator
"Private chats are easier.",Predator
"I want to know your daily routine.",Predator
"Good afternoon, hope all is well.",Non-Predator
"This platform has clear guidelines.",Non-Predator
"Respectful communication matters.",Non-Predator
"Do not reply to suspicious messages.",Non-Predator
"Online safety is very important.",Non-Predator
"Public discussions are encouraged.",Non-Predator
"It is fine to block strangers.",Non-Predator
"Ask a trusted adult if unsure.",Non-Predator
"Thank you for reporting issues.",Non-Predator
"Community moderation keeps us safe.",Non-Predator
"Let us keep this just between us.",Predator
"I will help you secretly.",Predator
"You can share things only with me.",Predator
"Others do not need to know.",Predator
"I feel you can trust me fully.",Predator
"Private conversations are better.",Predator
"We should talk outside this forum.",Predator
"Do not share our messages.",Predator
"I am always here only for you.",Predator
"We have a special understanding.",Predator
"Welcome to the discussion group.",Non-Predator
"This content follows the rules.",Non-Predator
"Let us help each other learn.",Non-Predator
"Everyone should be respectful.",Non-Predator
"This is a safe learning space.",Non-Predator
"Please stay within guidelines.",Non-Predator
"Thanks for contributing.",Non-Predator
"Public help benefits everyone.",Non-Predator
"Keep personal details private.",Non-Predator
"Stay cautious with strangers.",Non-Predator
"You do not need advice from others.",Predator
"I can guide you privately.",Predator
"Let us not involve moderators.",Predator
"It is easier if we talk alone.",Predator
"I know what is best for you.",Predator
"Keep this conversation secret.",Predator
"We should avoid public chats.",Predator
"You can rely only on me.",Predator
"No one else needs to know.",Predator
"Our chats are special.",Predator
"Thank you all for joining.",Non-Predator
"This discussion is productive.",Non-Predator
"It is good to ask questions.",Non-Predator
"Learning together is helpful.",Non-Predator
"Please respect privacy rules.",Non-Predator
"Online communities need trust.",Non-Predator
"Public chats reduce risk.",Non-Predator
"Let us follow safety tips.",Non-Predator
"Reporting issues helps everyone.",Non-Predator
"Community support is important.",Non-Predator
"I will message you secretly.",Predator
"We should talk without others.",Predator
"Do not show this chat to anyone.",Predator
"I care about you more than others.",Predator
"It is better to keep this private.",Predator
"We can chat when no one is online.",Predator
"You can tell me anything.",Predator
"I will keep your secrets.",Predator
"This stays between us.",Predator
"I want to know more about you.",Predator
